{
  "schema_version": 1,
  "generated_at": "2026-10-25T12:40:54Z",
  "changed_at": "2026-10-25T06:36:30Z",
  "source": "НЕК «Укренерго» — неофіційно, без гарантій",
  "statuses": {
    "normal": {
      "code": 3,
      "emoji": "🟢",
      "color": "#55a349",
      "title_uk": "Електроенергії достатньо",
      "title_en": "Sufficient electricity is available"
    },
    "shortage": {
      "code": 4,
      "emoji": "🟡",
      "color": "#f9ac1a",
      "title_uk": "Будь ласка, споживайте електроенергію ощадливо",
      "title_en": "Please use electricity sparingly"
    },
    "outage_schedules": {
      "code": 9,
      "emoji": "🔴",
      "color": "#c82400",
      "title_uk": "Застосовані графіки погодинних відключень",
      "title_en": "Hourly outage schedules are in effect"
    },
    "emergency_outages": {
      "code": 10,
      "emoji": "🚨",
      "color": "#e54825",
      "title_uk": "Застосовані аварійні відключення",
      "title_en": "Emergency outages are in effect"
    },
    "grid_damage": {
      "code": 11,
      "emoji": "⚫️",
      "color": "#006600",
      "title_uk": "Знеструмлення – наслідок пошкодження мережі",
      "title_en": "Power outage caused by grid damage"
    }
  },
  "regions": [
    {
      "id": 3,
      "slug": "khmelnytskyi",
      "name_uk": "Хмельницька область",
      "name_en": "Khmelnytskyi Oblast",
      "status": "normal",
      "status_code": 3,
      "emoji": "🟢",
      "color": "#55a349",
      "title_uk": "Електроенергії достатньо",
      "title_en": "Sufficient electricity is available",
      "since": "2026-10-17T19:51:49Z",
      "period": null,
      "next_change": null
    },
    {
      "id": 4,
      "slug": "vinnytsia",
      "name_uk": "Вінницька область",
      "name_en": "Vinnytsia Oblast",
      "status": "normal",
      "status_code": 3,
      "emoji": "🟢",
      "color": "#55a349",
      "title_uk": "Електроенергії достатньо",
      "title_en": "Sufficient electricity is available",
      "since": "2026-10-17T19:51:49Z",
      "period": null,
      "next_change": null
    },
    {
      "id": 5,
      "slug": "rivne",
      "name_uk": "Рівненська область",
      "name_en": "Rivne Oblast",
      "status": "normal",
      "status_code": 3,
      "emoji": "🟢",
      "color": "#55a349",
      "title_uk": "Електроенергії достатньо",
      "title_en": "Sufficient electricity is available",
      "since": "2026-10-17T19:51:49Z",
      "period": null,
      "next_change": null
    },
    {
      "id": 8,
      "slug": "volyn",
      "name_uk": "Волинська область",
      "name_en": "Volyn Oblast",
      "status": "normal",
      "status_code": 3,
      "emoji": "🟢",
      "color": "#55a349",
      "title_uk": "Електроенергії достатньо",
      "title_en": "Sufficient electricity is available",
      "since": "2026-10-17T19:51:49Z",
      "period": null,
      "next_change": null
    },
    {
      "id": 9,
      "slug": "dnipropetrovsk",
      "name_uk": "Дніпропетровська область",
      "name_en": "Dnipropetrovsk Oblast",
      "status": "normal",
      "status_code": 3,
      "emoji": "🟢",
      "color": "#55a349",
      "title_uk": "Електроенергії достатньо",
      "title_en": "Sufficient electricity is available",
      "since": "2026-10-17T19:51:49Z",
      "period": null,
      "next_change": null
    },
    {
      "id": 10,
      "slug": "zhytomyr",
      "name_uk": "Житомирська область",
      "name_en": "Zhytomyr Oblast",
      "status": "shortage",
      "status_code": 4,
      "emoji": "🟡",
      "color": "#f9ac1a",
      "title_uk": "Будь ласка, споживайте електроенергію ощадливо",
      "title_en": "Please use electricity sparingly",
      "since": "2026-10-25T06:35:27Z",
      "period": {
        "start": "2026-10-25T06:00:00Z",
        "end": "2026-10-25T21:59:00Z"
      },
      "next_change": null
    },
    {
      "id": 11,
      "slug": "zakarpattia",
      "name_uk": "Закарпатська область",
      "name_en": "Zakarpattia Oblast",
      "status": "normal",
      "status_code": 3,
      "emoji": "🟢",
      "color": "#55a349",
      "title_uk": "Електроенергії достатньо",
      "title_en": "Sufficient electricity is available",
      "since": "2026-10-17T19:51:49Z",
      "period": null,
      "next_change": null
    },
    {
      "id": 12,
      "slug": "zaporizhzhia",
      "name_uk": "Запорізька область",
      "name_en": "Zaporizhzhia Oblast",
      "status": "normal",
      "status_code": 3,
      "emoji": "🟢",
      "color": "#55a349",
      "title_uk": "Електроенергії достатньо",
      "title_en": "Sufficient electricity is available",
      "since": "2026-10-17T19:51:49Z",
      "period": null,
      "next_change": null
    },
    {
      "id": 13,
      "slug": "ivano-frankivsk",
      "name_uk": "Івано-Франківська область",
      "name_en": "Ivano-Frankivsk Oblast",
      "status": "normal",
      "status_code": 3,
      "emoji": "🟢",
      "color": "#55a349",
      "title_uk": "Електроенергії достатньо",
      "title_en": "Sufficient electricity is available",
      "since": "2026-10-17T19:51:49Z",
      "period": null,
      "next_change": null
    },
    {
      "id": 14,
      "slug": "kyiv-oblast",
      "name_uk": "Київська область",
      "name_en": "Kyiv Oblast",
      "status": "shortage",
      "status_code": 4,
      "emoji": "🟡",
      "color": "#f9ac1a",
      "title_uk": "Будь ласка, споживайте електроенергію ощадливо",
      "title_en": "Please use electricity sparingly",
      "since": "2026-10-25T06:35:27Z",
      "period": {
        "start": "2026-10-25T06:00:00Z",
        "end": "2026-10-25T21:59:00Z"
      },
      "next_change": null
    },
    {
      "id": 15,
      "slug": "kirovohrad",
      "name_uk": "Кіровоградська область",
      "name_en": "Kirovohrad Oblast",
      "status": "normal",
      "status_code": 3,
      "emoji": "🟢",
      "color": "#55a349",
      "title_uk": "Електроенергії достатньо",
      "title_en": "Sufficient electricity is available",
      "since": "2026-10-17T19:51:49Z",
      "period": null,
      "next_change": null
    },
    {
      "id": 16,
      "slug": "luhansk",
      "name_uk": "Луганська область",
      "name_en": "Luhansk Oblast",
      "status": "normal",
      "status_code": 3,
      "emoji": "🟢",
      "color": "#55a349",
      "title_uk": "Електроенергії достатньо",
      "title_en": "Sufficient electricity is available",
      "since": "2026-10-17T19:51:49Z",
      "period": null,
      "next_change": null
    },
    {
      "id": 17,
      "slug": "mykolaiv",
      "name_uk": "Миколаївська область",
      "name_en": "Mykolaiv Oblast",
      "status": "normal",
      "status_code": 3,
      "emoji": "🟢",
      "color": "#55a349",
      "title_uk": "Електроенергії достатньо",
      "title_en": "Sufficient electricity is available",
      "since": "2026-10-17T19:51:49Z",
      "period": null,
      "next_change": null
    },
    {
      "id": 18,
      "slug": "odesa",
      "name_uk": "Одеська область",
      "name_en": "Odesa Oblast",
      "status": "normal",
      "status_code": 3,
      "emoji": "🟢",
      "color": "#55a349",
      "title_uk": "Електроенергії достатньо",
      "title_en": "Sufficient electricity is available",
      "since": "2026-10-17T19:51:49Z",
      "period": null,
      "next_change": null
    },
    {
      "id": 19,
      "slug": "poltava",
      "name_uk": "Полтавська область",
      "name_en": "Poltava Oblast",
      "status": "shortage",
      "status_code": 4,
      "emoji": "🟡",
      "color": "#f9ac1a",
      "title_uk": "Будь ласка, споживайте електроенергію ощадливо",
      "title_en": "Please use electricity sparingly",
      "since": "2026-10-25T06:35:27Z",
      "period": {
        "start": "2026-10-25T06:00:00Z",
        "end": "2026-10-25T21:59:00Z"
      },
      "next_change": null
    },
    {
      "id": 20,
      "slug": "sumy",
      "name_uk": "Сумська область",
      "name_en": "Sumy Oblast",
      "status": "shortage",
      "status_code": 4,
      "emoji": "🟡",
      "color": "#f9ac1a",
      "title_uk": "Будь ласка, споживайте електроенергію ощадливо",
      "title_en": "Please use electricity sparingly",
      "since": "2026-10-25T06:35:27Z",
      "period": {
        "start": "2026-10-25T06:00:00Z",
        "end": "2026-10-25T21:59:00Z"
      },
      "next_change": null
    },
    {
      "id": 21,
      "slug": "ternopil",
      "name_uk": "Тернопільська область",
      "name_en": "Ternopil Oblast",
      "status": "normal",
      "status_code": 3,
      "emoji": "🟢",
      "color": "#55a349",
      "title_uk": "Електроенергії достатньо",
      "title_en": "Sufficient electricity is available",
      "since": "2026-10-17T19:51:49Z",
      "period": null,
      "next_change": null
    },
    {
      "id": 22,
      "slug": "kharkiv",
      "name_uk": "Харківська область",
      "name_en": "Kharkiv Oblast",
      "status": "shortage",
      "status_code": 4,
      "emoji": "🟡",
      "color": "#f9ac1a",
      "title_uk": "Будь ласка, споживайте електроенергію ощадливо",
      "title_en": "Please use electricity sparingly",
      "since": "2026-10-25T06:35:27Z",
      "period": {
        "start": "2026-10-25T06:00:00Z",
        "end": "2026-10-25T21:59:00Z"
      },
      "next_change": null
    },
    {
      "id": 23,
      "slug": "kherson",
      "name_uk": "Херсонська область",
      "name_en": "Kherson Oblast",
      "status": "normal",
      "status_code": 3,
      "emoji": "🟢",
      "color": "#55a349",
      "title_uk": "Електроенергії достатньо",
      "title_en": "Sufficient electricity is available",
      "since": "2026-10-17T19:51:49Z",
      "period": null,
      "next_change": null
    },
    {
      "id": 24,
      "slug": "cherkasy",
      "name_uk": "Черкаська область",
      "name_en": "Cherkasy Oblast",
      "status": "shortage",
      "status_code": 4,
      "emoji": "🟡",
      "color": "#f9ac1a",
      "title_uk": "Будь ласка, споживайте електроенергію ощадливо",